{
  "brief_id": "br_nm-albuquerque_growth_mode2_2026-05-22",
  "community_id": "nm-albuquerque",
  "community_name": "Albuquerque",
  "state": "NM",
  "preset": "growth",
  "mode": 2,
  "mode_label": "Strategic Brief",
  "classification": "WATCHLIST / MONITOR",
  "composite_score": 4.95,
  "confidence_overall": "LOW",
  "data_through": "2025-09-02",
  "generated_at": "2026-05-22T19:13:20.492670Z",
  "generated_by": "claude-sonnet-4-5",
  "executive_snapshot": "Albuquerque scores 5.0 (WATCHLIST) for growth operators, driven by high charter saturation (54 schools) offsetting strong academic need (43% ELA, 25% math proficiency). Two accessible authorizers (PEC and APS) and proven multi-campus operators create replication-friendly conditions. Key risk: market saturation limits competitive opportunity. Key opportunity: quality gap in district performance creates demand for high-performing alternatives.",
  "scorecard_summary": {
    "composite_score": 4.95,
    "tier_display_label": "WATCHLIST / MONITOR",
    "override_flags": [
      {
        "flag": "REPLICATION_FRIENDLY",
        "triggered_by": "Strong replication readiness AND favorable authorizer",
        "tier_effect": "No tier cap \u2014 positive signal",
        "visual": "\ud83d\udfe2"
      }
    ],
    "top_drivers": [
      {
        "dimension": "charter_saturation",
        "score": 1.0,
        "driver": "54 active charter schools signal a mature, potentially saturated market where new entrants face intense competition for enrollment and differentiation."
      },
      {
        "dimension": "academic_need",
        "score": 7.0,
        "driver": "District proficiency rates below 50% in ELA and 25% in math create demand for higher-performing alternatives, particularly in underserved neighborhoods."
      },
      {
        "dimension": "authorizer_friendliness",
        "score": 7.0,
        "driver": "Dual authorizer access (state PEC and local APS) provides pathway flexibility for operators with different growth strategies and community ties."
      }
    ],
    "dimension_table": [
      {
        "dimension": "academic_need",
        "display_name": "Academic Need",
        "score": 7.0,
        "weight": 0.1,
        "confidence": "HIGH",
        "driver": "Low district proficiency creates demand for quality alternatives, especially in math where only 1 in 4 students meets standards."
      },
      {
        "dimension": "charter_saturation",
        "display_name": "Charter Saturation",
        "score": 1.0,
        "weight": 0.14,
        "confidence": "HIGH",
        "driver": "54 charter schools represent significant market penetration; new entrants must demonstrate clear differentiation or superior performance."
      },
      {
        "dimension": "population_trends",
        "display_name": "Population Trends",
        "score": 5.0,
        "weight": 0.12,
        "confidence": "LOW",
        "driver": "73,000-student district provides scale, but enrollment trend data unavailable to assess growth trajectory or demographic shifts."
      },
      {
        "dimension": "political_climate",
        "display_name": "Political Climate",
        "score": 5.0,
        "weight": 0.09,
        "confidence": "MODERATE",
        "driver": "Neutral-to-supportive environment based on recent school board composition; no evidence of hostile policy shifts or charter restrictions."
      },
      {
        "dimension": "authorizer_friendliness",
        "display_name": "Authorizer Friendliness",
        "score": 7.0,
        "weight": 0.12,
        "confidence": "HIGH",
        "driver": "PEC state authorizer approves majority of schools; APS district authorizer offers local pathway for community-rooted operators."
      },
      {
        "dimension": "facilities_feasibility",
        "display_name": "Facilities Feasibility",
        "score": 5.0,
        "weight": 0.11,
        "confidence": "LOW",
        "driver": "No verified facilities data available; urban market assumption suggests moderate availability but requires local market research."
      },
      {
        "dimension": "replication_feasibility",
        "display_name": "Replication Feasibility",
        "score": 7.75,
        "weight": 0.07,
        "confidence": "HIGH",
        "driver": "Established multi-campus operators (Mission Achievement, ACES Technical, South Valley Prep) demonstrate proven replication pathways and operational infrastructure."
      },
      {
        "dimension": "funding_environment",
        "display_name": "Funding Environment",
        "score": 5.0,
        "weight": 0.08,
        "confidence": "LOW",
        "driver": "No verified philanthropic or grant data available; operators should assess local foundation landscape and state funding stability."
      },
      {
        "dimension": "competitive_opportunity",
        "display_name": "Competitive Opportunity",
        "score": 4.0,
        "weight": 0.12,
        "confidence": "MODERATE",
        "driver": "Quality gap exists but high charter density limits white space; success requires differentiated model or superior execution in underserved segments."
      },
      {
        "dimension": "operational_complexity",
        "display_name": "Operational Complexity",
        "score": 5.0,
        "weight": 0.05,
        "confidence": "LOW",
        "driver": "No verified ELL/IEP data available; urban district likely presents moderate-to-high complexity requiring specialized student support capacity."
      }
    ]
  },
  "recommendations": [
    {
      "action": "Pursue PEC authorization pathway for operators with proven track records in similar urban markets seeking statewide scale.",
      "rationale": "PEC approves majority of charters and offers state-level credibility; established operators like Mission Achievement and ACES Technical demonstrate successful multi-campus expansion through this route.",
      "evidence_summary": "PEC state authorizer approves most schools; multiple operators run 2+ campuses successfully.",
      "primary_risk": "High charter saturation (54 schools) means PEC may prioritize differentiated models or underserved geographic pockets over general replication.",
      "confidence": "HIGH",
      "supporting_fact_ids": [
        "dp_nm-albuquerque_authorizer_friendliness_001",
        "dp_nm-albuquerque_authorizer_friendliness_002",
        "dp_nm-albuquerque_replication_feasibility_001",
        "dp_nm-albuquerque_replication_feasibility_002"
      ]
    },
    {
      "action": "Target math-focused or STEM models to address 24.58% proficiency gap, positioning as district performance alternative.",
      "rationale": "Math proficiency significantly lags ELA (24.58% vs 43.07%), creating acute need. Quality gap documented in district performance data provides competitive positioning opportunity.",
      "evidence_summary": "District math proficiency at 24.58%, well below ELA; quality gap verified by state data.",
      "primary_risk": "54 existing charters may already serve high-demand segments; market research required to identify underserved neighborhoods or grade bands.",
      "confidence": "MODERATE",
      "supporting_fact_ids": [
        "dp_nm-albuquerque_academic_need_002",
        "dp_nm-albuquerque_academic_need_001",
        "dp_nm-albuquerque_competitive_opportunity_002",
        "dp_nm-albuquerque_charter_saturation_001"
      ]
    }
  ],
  "quick_reads": {
    "facilities": "No verified facilities data available for Albuquerque. Urban market suggests commercial real estate options exist, but operators must independently assess availability, cost, and zoning. Facilities feasibility scored 5.0 (neutral) by default due to data gap.",
    "political": "Political climate index of 6 indicates neutral-to-supportive environment based on 2025 school board composition. No evidence of hostile charter legislation or district opposition. Moderate confidence due to reliance on single media source; local stakeholder interviews recommended.",
    "authorizer": "Two authorizers serve Albuquerque: PEC (state-level, approves majority) and APS (district-level, local focus). PEC pathway suits operators seeking statewide scale; APS pathway suits community-rooted applicants. Both accessible, with established approval track records."
  },
  "schools_to_watch": [],
  "needs_verification": [
    {
      "claim": "Enrollment trends for APS district",
      "reason": "Only static 2024 enrollment (73,000) available; no multi-year trend data to assess growth or decline",
      "source_class_attempted": "PRIMARY_GOVT",
      "resolution_path": "APS enrollment reports 2019-2024",
      "impact_if_wrong": "HIGH"
    },
    {
      "claim": "Facilities market conditions and costs",
      "reason": "No commercial real estate or facilities data located for Albuquerque charter market",
      "source_class_attempted": "UNVERIFIED",
      "resolution_path": "Local broker interviews, CoStar data",
      "impact_if_wrong": "HIGH"
    },
    {
      "claim": "Philanthropic funding landscape",
      "reason": "No foundation or grant activity data found for New Mexico charter sector",
      "source_class_attempted": "UNVERIFIED",
      "resolution_path": "Foundation Center, state charter association",
      "impact_if_wrong": "MODERATE"
    },
    {
      "claim": "ELL and IEP student population percentages",
      "reason": "No district demographic data located to assess operational complexity drivers",
      "source_class_attempted": "UNVERIFIED",
      "resolution_path": "APS demographic reports, NCES data",
      "impact_if_wrong": "MODERATE"
    },
    {
      "claim": "Recent charter application approval rates",
      "reason": "Authorizer structure known but approval/denial rates not documented",
      "source_class_attempted": "PED_DATA",
      "resolution_path": "PEC annual reports 2020-2025",
      "impact_if_wrong": "MODERATE"
    }
  ],
  "sources": [
    {
      "ref_num": 1,